{"$schema":"https://json-schema.org/draft/2020-12/schema","type":"object","properties":{"schemaVersion":{"type":"number","const":3},"source":{"type":"object","properties":{"inputsDigest":{"type":"string","pattern":"^[0-9a-f]{64}$"}},"required":["inputsDigest"],"additionalProperties":false},"generatorMeta":{"type":"object","propertyNames":{"type":"string"},"additionalProperties":{"$ref":"#/$defs/__schema0"}},"targets":{"type":"object","propertyNames":{"type":"string"},"additionalProperties":{"type":"object","properties":{"baseUrl":{"type":"string","allOf":[{"pattern":"^https?:\\/\\/[^\\s/?#]\\S*$"},{"pattern":"^(?![\\s\\S]*\\{\\{secrets\\.)[\\s\\S]*$"}]},"browser":{"type":"string","const":"chromium"},"secretSinkOrigins":{"type":"object","propertyNames":{"type":"string","pattern":"^\\{\\{secrets\\.[A-Za-z0-9_]+(?:\\.[A-Za-z0-9_]+)*\\}\\}$"},"additionalProperties":{"type":"array","items":{"type":"string","allOf":[{"pattern":"^https?:\\/\\/[a-zA-Z0-9](?:[a-zA-Z0-9-]{0,61}[a-zA-Z0-9])?(?:\\.[a-zA-Z0-9](?:[a-zA-Z0-9-]{0,61}[a-zA-Z0-9])?)*(?::(?:6553[0-5]|655[0-2][0-9]|65[0-4][0-9]{2}|6[0-4][0-9]{3}|[1-5][0-9]{4}|[1-9][0-9]{0,3}))?$"},{"pattern":"^(?![\\s\\S]*\\{\\{secrets\\.)[\\s\\S]*$"}]}}}},"required":["baseUrl","browser"],"additionalProperties":false}},"steps":{"type":"array","items":{"oneOf":[{"oneOf":[{"type":"object","properties":{"id":{"type":"string","pattern":"^[a-z][a-z0-9]*(-[a-z0-9]+)*$"},"kind":{"type":"string","const":"action"},"action":{"type":"string","const":"click"},"target":{"oneOf":[{"type":"object","properties":{"strategy":{"type":"string","const":"accessibility"},"role":{"type":"string","minLength":1},"name":{"type":"string","minLength":1}},"required":["strategy","role","name"],"additionalProperties":false}]}},"required":["id","kind","action","target"],"additionalProperties":false},{"type":"object","properties":{"id":{"type":"string","pattern":"^[a-z][a-z0-9]*(-[a-z0-9]+)*$"},"kind":{"type":"string","const":"action"},"action":{"type":"string","const":"navigate"},"url":{"type":"string","pattern":"^(?![\\s\\S]*\\{\\{secrets\\.)[\\s\\S]*$"}},"required":["id","kind","action","url"],"additionalProperties":false},{"type":"object","properties":{"id":{"type":"string","pattern":"^[a-z][a-z0-9]*(-[a-z0-9]+)*$"},"kind":{"type":"string","const":"action"},"action":{"type":"string","const":"press"},"target":{"oneOf":[{"type":"object","properties":{"strategy":{"type":"string","const":"accessibility"},"role":{"type":"string","minLength":1},"name":{"type":"string","minLength":1}},"required":["strategy","role","name"],"additionalProperties":false}]},"key":{"type":"string","enum":["Enter","Tab","Escape","ArrowDown","ArrowUp"]}},"required":["id","kind","action","target","key"],"additionalProperties":false},{"type":"object","properties":{"id":{"type":"string","pattern":"^[a-z][a-z0-9]*(-[a-z0-9]+)*$"},"kind":{"type":"string","const":"action"},"action":{"type":"string","const":"fill"},"target":{"oneOf":[{"type":"object","properties":{"strategy":{"type":"string","const":"accessibility"},"role":{"type":"string","minLength":1},"name":{"type":"string","minLength":1}},"required":["strategy","role","name"],"additionalProperties":false}]},"value":{"type":"string","pattern":"^(?![\\s\\S]*\\{\\{secrets\\.)[\\s\\S]*$"}},"required":["id","kind","action","target","value"],"additionalProperties":false},{"type":"object","properties":{"id":{"type":"string","pattern":"^[a-z][a-z0-9]*(-[a-z0-9]+)*$"},"kind":{"type":"string","const":"action"},"action":{"type":"string","const":"fill-secret"},"target":{"oneOf":[{"type":"object","properties":{"strategy":{"type":"string","const":"accessibility"},"role":{"type":"string","minLength":1},"name":{"type":"string","minLength":1}},"required":["strategy","role","name"],"additionalProperties":false}]},"secretRef":{"type":"string","pattern":"^\\{\\{secrets\\.[A-Za-z0-9_]+(?:\\.[A-Za-z0-9_]+)*\\}\\}$"}},"required":["id","kind","action","target","secretRef"],"additionalProperties":false}]},{"oneOf":[{"type":"object","properties":{"id":{"type":"string","pattern":"^[a-z][a-z0-9]*(-[a-z0-9]+)*$"},"kind":{"type":"string","const":"assert"},"check":{"type":"string","const":"text-visible"},"text":{"type":"string","pattern":"^(?![\\s\\S]*\\{\\{secrets\\.)[\\s\\S]*$"}},"required":["id","kind","check","text"],"additionalProperties":false},{"type":"object","properties":{"id":{"type":"string","pattern":"^[a-z][a-z0-9]*(-[a-z0-9]+)*$"},"kind":{"type":"string","const":"assert"},"check":{"type":"string","const":"element-visible"},"target":{"oneOf":[{"type":"object","properties":{"strategy":{"type":"string","const":"accessibility"},"role":{"type":"string","minLength":1},"name":{"type":"string","minLength":1}},"required":["strategy","role","name"],"additionalProperties":false}]}},"required":["id","kind","check","target"],"additionalProperties":false},{"type":"object","properties":{"id":{"type":"string","pattern":"^[a-z][a-z0-9]*(-[a-z0-9]+)*$"},"kind":{"type":"string","const":"assert"},"check":{"type":"string","const":"text-equals"},"target":{"oneOf":[{"type":"object","properties":{"strategy":{"type":"string","const":"accessibility"},"role":{"type":"string","minLength":1},"name":{"type":"string","minLength":1}},"required":["strategy","role","name"],"additionalProperties":false}]},"text":{"type":"string","pattern":"^(?![\\s\\S]*\\{\\{secrets\\.)[\\s\\S]*$"}},"required":["id","kind","check","target","text"],"additionalProperties":false},{"type":"object","properties":{"id":{"type":"string","pattern":"^[a-z][a-z0-9]*(-[a-z0-9]+)*$"},"kind":{"type":"string","const":"assert"},"check":{"type":"string","const":"url-matches"},"pattern":{"type":"string","pattern":"^(?![\\s\\S]*\\{\\{secrets\\.)[\\s\\S]*$"}},"required":["id","kind","check","pattern"],"additionalProperties":false},{"type":"object","properties":{"id":{"type":"string","pattern":"^[a-z][a-z0-9]*(-[a-z0-9]+)*$"},"kind":{"type":"string","const":"assert"},"check":{"type":"string","const":"element-count"},"target":{"oneOf":[{"type":"object","properties":{"strategy":{"type":"string","const":"accessibility"},"role":{"type":"string","minLength":1},"name":{"type":"string","minLength":1}},"required":["strategy","role","name"],"additionalProperties":false}]},"count":{"type":"integer","minimum":0,"maximum":9007199254740991}},"required":["id","kind","check","target","count"],"additionalProperties":false}]},{"type":"object","properties":{"id":{"type":"string","pattern":"^[a-z][a-z0-9]*(-[a-z0-9]+)*$"},"kind":{"type":"string","const":"capture"},"target":{"oneOf":[{"type":"object","properties":{"strategy":{"type":"string","const":"accessibility"},"role":{"type":"string","minLength":1},"name":{"type":"string","minLength":1}},"required":["strategy","role","name"],"additionalProperties":false}]},"variable":{"type":"string","pattern":"^[a-z][a-zA-Z0-9]*$"}},"required":["id","kind","target","variable"],"additionalProperties":false},{"type":"object","properties":{"id":{"type":"string","pattern":"^[a-z][a-z0-9]*(-[a-z0-9]+)*$"},"kind":{"type":"string","const":"ai"},"instruction":{"type":"string","pattern":"^(?![\\s\\S]*\\{\\{secrets\\.)[\\s\\S]*$"},"secrets":{"type":"array","items":{"type":"object","properties":{"ref":{"type":"string","pattern":"^\\{\\{secrets\\.[A-Za-z0-9_]+(?:\\.[A-Za-z0-9_]+)*\\}\\}$"}},"required":["ref"],"additionalProperties":false}},"instructionCoverage":{"minItems":1,"type":"array","items":{"type":"object","properties":{"id":{"type":"string","pattern":"^[a-z][a-z0-9]*(-[a-z0-9]+)*$"},"kind":{"type":"string","enum":["success","action"]},"sourceSpan":{"type":"object","properties":{"startLine":{"type":"integer","exclusiveMinimum":0,"maximum":9007199254740991},"startColumn":{"type":"integer","exclusiveMinimum":0,"maximum":9007199254740991},"endLine":{"type":"integer","exclusiveMinimum":0,"maximum":9007199254740991},"endColumn":{"type":"integer","exclusiveMinimum":0,"maximum":9007199254740991}},"required":["startLine","startColumn","endLine","endColumn"],"additionalProperties":false}},"required":["id","kind","sourceSpan"],"additionalProperties":false}}},"required":["id","kind","instruction","instructionCoverage"],"additionalProperties":false}]}}},"required":["schemaVersion","source","targets","steps"],"additionalProperties":false,"$defs":{"__schema0":{"anyOf":[{"type":"string"},{"type":"number"},{"type":"boolean"},{"type":"null"},{"type":"array","items":{"$ref":"#/$defs/__schema0"}},{"type":"object","propertyNames":{"type":"string"},"additionalProperties":{"$ref":"#/$defs/__schema0"}}]}},"$id":"https://kotarotsubaki.github.io/ambercast/schemas/plan.v3.schema.json","title":"ambercast plan schema v3","description":"Validates the complete generated plan document that is reviewed and committed beside its source test prompt."}