{
  "schemaVersion": 3,
  "source": {
    "inputsDigest": "0000000000000000000000000000000000000000000000000000000000000000"
  },
  "steps": [
    {
      "action": "navigate",
      "id": "navigate-home",
      "kind": "action",
      "url": "https://example.test/login"
    },
    {
      "check": "text-visible",
      "id": "assert-welcome",
      "kind": "assert",
      "text": "Welcome"
    }
  ],
  "targets": {
    "app": {
      "baseUrl": "https://example.test",
      "browser": "chromium"
    }
  }
}
